id,name,description,url,openingHours,duration,price,address,avgRating,numReviews,numReviews_5,numReviews_4,numReviews_3,numReviews_2,numReviews_1
16649256,Duxton Plain Park,,https://www.tripadvisor.com/Attraction_Review-g294265-d16649256-Reviews-Duxton_Plain_Park-Singapore.html,,< 1 hour,,"New Bridge Road, Singapore 089140 Singapore",3.5,4,0,2,2,0,0
19786382,Gardens By The Bay East,,https://www.tripadvisor.com/Attraction_Review-g294265-d19786382-Reviews-Gardens_By_The_Bay_East-Singapore.html,12:00 AM - 11:59 PM,,,"11 Rhu Cross Passion Wave @ Marina Bay, Singapore 437440 Singapore",4.5,3,2,1,0,0,0
15050991,Let's Go Cook Singapore,"Join our cosy and fun classes to cook local favourites! Ideal for tourists, couples, families, friends and corporate groups! Private classes available too! What are you waiting for? Join us to cook Our Food, Your Way!",https://www.tripadvisor.com/Attraction_Review-g294265-d15050991-Reviews-Let_s_Go_Cook_Singapore-Singapore.html,,2-3 hours,,"Block 462 Crawford Lane Unit 01-57, Singapore 190462 Singapore",5.0,479,462,16,2,0,0
14904083,Commune Kitchen,"Be it traditional Chinese dumplings or gluten-free dumplings, xiao long bao, laksa, chili crab, satay, Peranakan, Indian or gluten-free breads, we got it all covered! Join us for a full hands-on cooking class in our state of the art kitchen at Frasers Tower Downtown under the guidance of our star chefs. Work in small intimate groups of 3-4 people on your own cooking station followed by a sit-down meal in a fun and relaxed atmosphere. Corporate Team building and Private Cooking Classes also available!",https://www.tripadvisor.com/Attraction_Review-g294265-d14904083-Reviews-Commune_Kitchen-Singapore.html,10:00 AM - 4:00 PM,2-3 hours,,"182 Cecil Street #02-10/11 Frasers Tower, Singapore 069547 Singapore",5.0,379,365,13,1,0,0
25547486,The Mind Cafe Mega,"The Mind Cafe is a board game cafe - not just a standard cafe. Our goal is to share our love of board games! Everyone is welcome to The Mind Cafe to play with our extensive gaming library of at least 800 games! Do not fret if you are new to the world of board games. Our friendly game facilitators will recommend and teach you the games. We also provide a variety of food and beverages to keep you refreshed as you play. Join us for a board game tour on local games, drinks and snacks. See you soon !",https://www.tripadvisor.com/Attraction_Review-g294265-d25547486-Reviews-The_Mind_Cafe_Mega-Singapore.html,11:00 AM - 6:00 AM,2-3 hours,,"30 Prinsep Street #01-01, Singapore 188647 Singapore",5.0,54,47,5,2,0,0
2344513,Flyer Lounge @ Singapore Flyer,A chic and cosy bar located within the Singapore Flyer serving up award-winning cocktails that were previously unavailable to the public.,https://www.tripadvisor.com/Attraction_Review-g294265-d2344513-Reviews-Flyer_Lounge_Singapore_Flyer-Singapore.html,8:30 AM - 10:00 PM,,,"The Singapore Flyer 30 Raffles Avenue, Singapore 039803 Singapore",4.0,45,19,16,6,3,1
21200572,VR World Singapore,"VRWorld Singapore is a home-grown Virtual Reality gaming center with a focus on team-based collaborative or competitive games. Our extensive collection of super-fun, top-class VR Escape and Arcade Games provides the perfect bonding activity for family and friends. Located inside a spacious, multi-storey heritage shophouse within Chinatown, VRWorld is also the perfect place to hold your corporate team-building or private celebration events.",https://www.tripadvisor.com/Attraction_Review-g294265-d21200572-Reviews-VR_World_Singapore-Singapore.html,11:00 AM - 11:00 PM,1-2 hours,,"8A Sago Street, Singapore 059012 Singapore",4.5,9,8,0,0,0,1
590995,Seletar Country Club,"Designed by eminent course architect Chris Pitman, Seletar Country Club’s immaculately groomed 18-hole gem par 72 undulating at 6,381 metres goes well against the backdrop of the Lower Seletar Reservoir and verdant jungle canopy.",https://www.tripadvisor.com/Attraction_Review-g294265-d590995-Reviews-Seletar_Country_Club-Singapore.html,12:00 AM - 11:59 PM,,,"101 Seletar Club Road Seletar Country Club, Singapore 798273 Singapore",4.5,17,7,8,2,0,0
6412766,The Army Market,,https://www.tripadvisor.com/Attraction_Review-g294265-d6412766-Reviews-The_Army_Market-Singapore.html,11:00 AM - 8:30 PM,,,"505 Beach Road Golden Mile Food Centre Golden Mile Food Centre, 2nd Floor, Singapore 199583 Singapore",4.0,12,2,7,2,1,0
22834159,Geylang,,https://www.tripadvisor.com/Attraction_Review-g294265-d22834159-Reviews-Geylang-Singapore.html,,,,"447 Geylang Road Geylang Post Office, Singapore 389406 Singapore",4.5,3,2,1,0,0,0
23235560,Gallop Extension,,https://www.tripadvisor.com/Attraction_Review-g294265-d23235560-Reviews-Gallop_Extension-Singapore.html,,,,"5 Gallop Road, Singapore 258960 Singapore",4.5,3,2,1,0,0,0
23138270,Smith Street,,https://www.tripadvisor.com/Attraction_Review-g294265-d23138270-Reviews-Smith_Street-Singapore.html,,,,,4.5,3,1,2,0,0,0
7275891,Moshi Moshi Bollywood,"We are temporarily closed. Moshi Moshi Bollywood - your party and chill out place Opening Hours : Mon - Thu: 9:00 pm - 4:30 am Fri - Sat and Eve of Public Holidays: 9:00 pm - 5:00 am We are closed on Sundays unless it is a Public Holiday One of the Most Happening Clubs in Singapore. Bollywood, Belly Dancing and Hip Hop performed nightly by International Dancers. We take Fusion to the Max!!",https://www.tripadvisor.com/Attraction_Review-g294265-d7275891-Reviews-Moshi_Moshi_Bollywood-Singapore.html,Closed until further notice,2-3 hours,,"5 Koek Road #26-27 Cuppage Plaza Somerset MRT Station and next to Centrepoint Shopping Centre, Singapore 228796 Singapore",4.0,5,2,2,1,0,0
15360350,Maxicabooking SG,"MaxiCABooking SG strives to provide dedicated transportation services with a large fleet of limo cab, maxi cab & mini bus ranging from 4 seaters limo to 44 seater coach and not forgetting our party buses! Each vehicle comes with plush seats, spacious interior & seating arrangements. With the largest fleet in town, we are able to provide Fast, Reliable & Affordable transportation in Singapore.",https://www.tripadvisor.com/Attraction_Review-g294265-d15360350-Reviews-Maxicabooking_SG-Singapore.html,,,,"Singapore, Singapore 730437 Singapore",4.0,2,1,0,1,0,0
17821111,Low Salt Low Sugar,"Discover the joys of Peranakan cooking in rich, bold flavours and learn about the local herbs and spices central to the cuisine. Take delight in preparing two authentic dishes from scratch: Assam Fishhead and Ayam Pongteh (chicken stew with fermented soybean). End the workshop with a homey lunch - a great opportunity to take mouthwatering photos and share experiences and stories. Take NOTE, this workshop will require at least 2 people to start.",https://www.tripadvisor.com/Attraction_Review-g294265-d17821111-Reviews-Low_Salt_Low_Sugar-Singapore.html,,,,"323D Sumang Walk Punggol Bayview, Singapore 824323 Singapore",3.5,3,2,0,0,0,1
17738872,Zenith Wholesale Enterprise,"Our company has a fleet of vehicles to perform the below services :

Airport transfer
Charter service
Point to point transfer

Singapore - Malaysia Johor Bahru transfer and vice verse 

Legoland 
Hello Kitty Town 
Hotels/shopping complex around Johor Bahru",https://www.tripadvisor.com/Attraction_Review-g294265-d17738872-Reviews-Zenith_Wholesale_Enterprise-Singapore.html,7:00 AM - 11:30 PM,,,"50 Chin Swee Road Thong Chai Building, Singapore 169874 Singapore",2.5,6,1,1,0,1,3
26356283,Singapore airport,,https://www.tripadvisor.com/Attraction_Review-g294265-d26356283-Reviews-Singapore_airport-Singapore.html,,,,,,0,0,0,0,0,0
21353012,J2 Terrarium,"Terrariums are no stranger to the urban individual as they offer little pockets of nature to those living in the concrete jungle. J2 Terrarium offers custom made terrariums, ready made terrariums and even glass jars and vases for those looking for a nice home for their little gardens. Additionally, they offer workshops that cater to various age group, from young to old.",https://www.tripadvisor.com/Attraction_Review-g294265-d21353012-Reviews-J2_Terrarium-Singapore.html,,,25.59,"1 Yishun Industrial Street 1 #04-06 a'Posh Bizhub, Singapore 768160 Singapore",,0,0,0,0,0,0
20318911,D'Open Kitchen,"We whip up creativity, fun and teamwork through an array of cooking classes in Singapore conducted by our team of professional chefs. From seasonal cuisine to local fare and artisan desserts; our cooking classes are specially designed to suit enthusiasts of all levels. Explore a wide selection of culinary experiences with us ranging from leisure cooking classes to cooking team building events in Singapore.",https://www.tripadvisor.com/Attraction_Review-g294265-d20318911-Reviews-D_Open_Kitchen-Singapore.html,,,,"10 Anson Road, Singapore 079903 Singapore",,0,0,0,0,0,0
